,text,env
383,"We have a robust approach to managing risk, which encompasses the identification and assessment of risks, the establishment of policies and procedures to control and manage those risks and an organisation-wide approach to communicating and monitoring risks.  ",0
384,The amount of provision for doubtful debts is the best estimate of the Company's probable liability for credit losses.  ,0
385,"The Board of Directors, supported by the Audit Committee, has oversight of the Company's risk management and internal control processes.  ",0
386,This system is designed to enable our customers to build the widest possible picture of risks and opportunities arising from the interaction of a variety of factors.  ,0
387,"A large part of the Group's assets is exposed to the financial markets, thereby exposing the Group to the risk of losses resulting from fluctuations in interest and exchange rates.  ",0
388,We have initiated a comprehensive programme of actions to strengthen our governance processes and our capability to manage risks and opportunities.  ,0
389,"The Board has reviewed the policy annually to ensure that it remains relevant, and that we are focusing on the areas of most impact. ",0
390,My wife and I have a strong sense of social justice and I am pleased to be able to support the work of this organisation in its efforts to provide safe and secure homes for the most disadvantaged people in society.  ,0
391,"The Board is responsible for the Group's strategy and the implementation thereof, and for approving the annual operating budget and draft financial statements.  ",0
392,"The Board of Directors is responsible for the stewardship of the Corporation's resources, and for the oversight of the management of its affairs.  ",0
393,The Group has an active board of directors and a strong and active Shareholders' Committee.  ,0
394,"The Company's Board of Directors is committed to ensuring that the Group complies with all applicable laws, regulations and ethical guidelines.  ",0
395,Our Business Plan for 2018–2021 has been approved by shareholders and sets out the strategic objectives for the Group.  ,0
396,The Company is subject to the Corporate Governance Code for the Pharmaceutical Industry in France.  ,0
397,The Company is a member of the Roundtable on Sustainable Palm Oil (RSPO) and has been certified as a sustainable palm oil producer by the RSPO.  ,0
398,"We are also working on a variety of cost reduction initiatives, including engineering improvements and process changes in our production facilities.  ",0
399,"The association is a non-profit organization established in 1993, which promotes collaboration and cooperation among its members.  ",0
400,"We are committed to reducing the environmental impact of our activities and products, and our aim is to operate as an environmentally responsible company.  ",1
401,"The Company is fully committed to ensuring that its employees are treated equally, irrespective of gender, ethnic origin, disability, marital status, political opinion, nationality, religion, sexual orientation or age.  ",0
402,The board of directors is responsible for approving the general policies of the Company and for overseeing the management thereof.  ,0
403,A 'sustainable procurement' policy and supporting procedures were developed.  ,1
404,The Best Management Practices (BMPs) are mandatory requirements set by the Basel Committee on Banking Supervision (BCBS).  ,0
405,A high carbon intensity of electricity supply may be a factor in the choice of location.  ,1
406,"The Company is in the process of developing a Water Conservation Policy, which is expected to be completed during the current fiscal year.  ",1
407,We are also working to reduce energy consumption in our data centers and to increase the energy efficiency of our products.  ,1
408,An independent report on the Company's corporate governance in relation to the prevention and detection of fraud and other irregularities was published in March 2010.  ,0
409,"In 2011 the Group implemented a new sustainability strategy, entitled ""From Stagnation to Growth"".  ",1
410,The Group is subject to a range of regulatory requirements and the continued maintenance of our regulatory compliance is a key management focus.  ,0
411,"In any situation of systemic or significant non-compliance with laws and regulations, there is a risk that the Group could suffer financial loss, incur penalties or other sanctions, or be required to cease conducting business.  ",0
412,"The Group is committed to upholding the highest standards of corporate governance, which are fully integrated into its culture.  ",0
413,"The Company's Board, Management and employees are committed to ensuring that the Company is a safe and secure working environment where all employees are treated with dignity and respect.  ",0
414,"The company is a signatory to the UN Global Compact, which commits it to respect and promote human rights, labour standards, and the environment.  ",1
415,"The Management Board consists of the Chief Executive Officer, the Chief Financial Officer and the General Counsel.  ",0
416,The Company does not have any share incentive plans.  ,0
417,"The purpose is to provide all our employees with a safe and healthy working environment, to support the safety and health of our employees and to support the health and safety of all of our stakeholders.  ",0
418,The group's goal is to achieve a 10% return on invested capital by 2015.  ,0
419,"We have implemented a comprehensive sustainability strategy that is based on the three pillars of Social responsibility, Environmental responsibility and Good Governance.  ",1
420,"The Company has adopted a ³Fit for the Future² strategy to evolve and modernise itself, and to remain competitive on the market and meet the challenges of the future.  ",0
421,"This is achieved by means of a series of meetings, including the meetings of the Board of Directors and the Audit Committee, both of which are open to the public.  ",0
422,"The Board believes that the Company's long-term success depends on the achievement of the Company's environmental, social and governance targets by all stakeholders.  ",1
423,We promote the involvement of our employees in the implementation of the Group's Sustainable Development Strategy and foster their contribution in its implementation through a total of 20 working groups.  ,0
424,We have been a member of the Roundtable on Sustainable Palm Oil (RSPO) since 2010 and have been certified by the RSPO since January 2014.  ,0
425,We have a comprehensive range of health and safety policies and procedures in place.  ,0
426,We have internal policies and procedures to ensure that we are conducting our activities in an ethical and socially responsible manner.  ,0
427,The Group is committed to conducting its business in accordance with the highest ethical standards.  ,0
428,The Company is committed to ensuring that any vacancies arising are filled by the most qualified candidates and recognises the value of diversity in the composition of the Board.  ,0
429,"Our board is made up of a number of non-executive directors, including the chief executive of a local authority, a current and former police officer, and a local councillor.  ",0
430,The Company has a comprehensive health and safety program in place that is designed to ensure that all of its employees are safe while they work.  ,0
431,"Furthermore, the code of conduct is updated regularly and is available on the company's website (www.google.com).  ",0
432,"A strong, healthy and engaged workforce is fundamental to the success of any organisation.  ",0
433,"We are committed to reporting transparently on our initiatives, both in the annual report and in our sustainability report.  ",1
434,It is the responsibility of the Board of Directors to monitor on a regular basis the risks of the Group and to ensure that adequate risk management systems are in place.  ,0
435,"The performance of the Board and Committees is reviewed through the Remuneration Committee, and the Chairman is required to provide an annual performance report on the Committee's activities to the Board.  ",0
436,The Company is committed to ensure that its business activities do not cause or contribute to environmental damage and that the Company has in place environmental protection systems and processes to minimise the effects of its activities on the environment.  ,1
437,"Our vision is to be the employer of choice in the market, enabling our people to develop their skills, to maximise their contribution to the success of the business and to enjoy their work.  ",0
438,"On behalf of the Company, the Board of Directors is pleased to present its Corporate Responsibility Report for 2018.  ",1
439,The new Government is committed to continuing the programme of fiscal consolidation and we will continue to take difficult decisions in order to reduce debt as a share of GDP over the medium term.  ,0
440,"In addition, the Legal and Compliance Department and the Audit Committee regularly monitor the results of the independent auditor.  ",0
441,"The diversity and inclusion programme is focused on the recruitment and development of women, as well as on the protection of the rights of migrant workers.  ",0
442,The Company's policy is to ensure that the Company's operations do not cause damage to the environment.  ,1
443,This is a significant investment in the future development of the Group and I am confident that it will further enhance the Company's status and reputation.  ,0
444,"The Company is subject to various laws, rules and regulations applicable to its business.  ",0
445,"During the year under review, we continued to support the ongoing development of a number of young players, including through our sponsorship of the Arsenal FC Foundation.  ",0
446,The Group has established a Sustainable Development Committee that provides advice and monitors the implementation of the Group's environmental policy.  ,1
447,The Board and senior management are committed to developing and maintaining a culture of integrity and ethical conduct.  ,0
448,We are looking to embed the new Supply Chain Modern Slavery Business Standard and enhanced processes into the business.  ,0
449,"The Group has an Environmental Management System in place that addresses a number of environmental issues, including those relating to the use of energy, water and natural resources and waste management.  ",1
450,The Company's remuneration policy aims to link the interests of management with those of the shareholders and to provide incentives for the Company's management to perform well.  ,0
451,We have a strong focus on training and developing our people to help them reach their potential in their job and life.  ,0
452,The Office of the Chairman will also conduct a review of the remuneration and benefits provided to the Chairman and the related party transactions in respect of the Chairman's remuneration.  ,0
453,The Company will also make every effort to improve the effectiveness of its sustainability reporting.  ,1
454,"This includes a requirement to establish a Code of Conduct and a Code of Ethics, which are applicable to all employees, consultants and agents of the Company.  ",0
455,We are developing a governance framework which will be implemented in 2017 to guide the Board in its decision-making.  ,0
456,"Our strategy recognises that there are a number of factors that can affect the overall performance of the Group, including the economy in which we operate and the political and regulatory environment.  ",0
457,"In line with the requirements of the CSA, we are implementing a new compliance management system and have appointed a compliance officer.  ",0
458,"To ensure the independence of the Board, the shareholders of DWS KGaA agreed at the Annual General Meeting on 21 May 2015 to reduce the number of members of the Supervisory Board to six.  ",0
459,"One of the key principles of this approach is that the Group will continue to pay dividends to shareholders, whilst also delivering long-term value creation.  ",0
460,We will continue to work with our suppliers and consumers to reduce the environmental impact of our activities.  ,1
461,The Board has delegated responsibility for the implementation of the Policy to the Group Chief Executive and the Group Chief Executive has delegated responsibility for the implementation of the Policy to the Chief People Officer.  ,0
462,Our policy is to require each of our directors and executive officers to notify the Board promptly of any potential conflict of interest and to recuse themselves from any discussion or decision with respect to that potential conflict.  ,0
463,"In particular, the Corporate Governance Code recommends that the Board should oversee the development of a corporate strategy, including an appropriate response to environmental, social and governance issues.  ",1
464,"In order to increase the impact of the investment teams' efforts, the Board has also created a Social Impact Committee.  ",0
465,"ESG stands for Environmental, Social and Governance. ",1
466,"We are committed to the highest ethical standards and business practices, including compliance with all applicable laws and regulations.  ",0
467,The Company has a Code of Conduct and Ethics which is made available to all employees and is available on the Company's website.  ,0
468,The Board has formally delegated authority to the relevant Board Committees and Management.  ,0
469,"The company has a policy of sponsoring local, county and national charities and events.  ",0
470,Our Global Supply Chain Management Policy (the “Policy”) is a key component of our commitment to support the achievement of our corporate responsibility goals.  ,0
471,"We are committed to the highest standards of ethical conduct in our business dealings and in all aspects of our relationships with customers, suppliers, employees, shareholders, the communities in which we operate and the general public.  ",0
472,We also support and encourage efforts in the community.  ,0
473,The Board of Directors of each Subsidiary is comprised of at least one female director.  ,0
474,"The Group attaches considerable importance to the development of its staff, adapting the training programmes to the changing needs of the business. ",0
475,"We believe that running a responsible business is not just the right thing to do, but also the smart thing to do.  ",0
476,"Where there is significant risk of harm to the environment or the reputation of the Group, senior management will report the matter to the Board.  ",1
477,The Committee believes that the relationship between the Company and the communities in which it operates is of fundamental importance.  ,0
478,The Group has a Code of Conduct which applies to all Group employees and is aligned with the standards of the United Nations Global Compact.  ,0
479,The Group's remuneration policy is designed to support the delivery of the Group's strategy and its operating and financial objectives.  ,0
480,"In 2017 we reviewed our policy on non-executive directors' remuneration, which we felt was in need of updating.  ",0
481,"This was a difficult decision, but was necessary to ensure the long-term sustainability of the business.  ",1
482,"If a country has a lower ranking than other countries in the same region, then it is deemed to have a low level of governance.  ",0
483,These restrictions are applicable to all directors and employees of the Company and its subsidiaries and have been communicated to them.  ,0
484,This is a result of the Group's adoption of a foreign currency hedging policy and the prevailing exchange rate differences between the US dollar and the euro.  ,0
485,The Group's key performance indicators for the Group's corporate governance and sustainability framework are measured and reported on by the Group. ,1
486,"We also have a clear code of conduct to address integrity, conflict of interest, and fraud.  ",0
487,"We can provide a high-quality product using the most advanced technology and the best materials, and we can make our clothes in the right size to fit the customer.  ",0
488,The Group is committed to ensuring that any vacancies arising are filled by the most qualified candidates and recognises the value of diversity in the composition of the Board.  ,0
489,We also continue to focus on the environmental impact of our operations.  ,1
490,"In 2016, the Board of Directors and the administrative board of the Gesellschaft für Nuklear-Service mbH (GNS) agreed to end their cooperation.  ",0
491,The Company is committed to managing and improving its environmental impact and is striving to become 100% carbon neutral.  ,1
492,The Group has also identified key social and environmental issues that are relevant to its business activities and is working to address these effectively.  ,0
493,"In the UK, we have a long-standing commitment to reducing waste, and we have ambitious recycling targets for our stores and for our packaging.  ",1
494,"The Board has a clear understanding and recognition of the need to constantly adapt and modify available resources to help colleagues access remote well-being support, advice and resources.  ",0
495,The Company is not a subject to supervision under the provisions of the UK Financial Services and Markets Act 2000.  ,0
496,"In addition, the Group has an active policy for the prevention of conflict minerals in its products and is in the process of developing a conflict minerals disclosure policy, in line with SEC and EU expectations.  ",1
497,"The main objectives of the Regulation are to ensure that the directors' responsibilities are clearly defined, their independence is protected and that they are accountable for their decisions.  ",0
498,"We are committed to communicating the most relevant environmental, social and governance (ESG) topics, through publications, web portals and events, in order to keep our investors informed.  ",1
499,"In the case of the Audit Committee, the Board of Directors has adopted a policy for the nomination of its members.  ",0
0,In February the taxonomy criteria for new gas and nuclear power stations.,0
1,"Through the summer, strong competition for LNG supply as well as constraints from Russian pipeline gas supplies tightened the market and prevented stocks from being replenished.",0
2,sharing resources and benefiting from synergistic exchanges of experience and energy.,0
3,The incredible rise in the price of fuel and emission allowances shaped the trajectory of our most important wholesale electricity markets in Europe.,1
4,The Institute of Energy Economics at the University of Cologne (EWI) estimates that Germany needs to add gas-fired plants with a total capacity of country is set on phasing out coal over that same period.,1
5,"Examples include shale gas and oil, coalbed methane, gas hydrates and natural bitumen deposits.",1
6,"As part of the IED framework, additional emission limit values are informed by sector specific and cross-sector Best Available Technology (BAT) Conclusions.",1
7,"As an online business, number of companies that operate in more resource intensive industries.",0
8,"According to WindEurope, the European wind industry association, in about for electricity generation, the ocean is simply too deep for conventional foundation designs.",1
9,In resulted in total purchases of more than €125 million of agricultural raw materials.,1
10,"Estimated quantity (in metric tons) of agricultural ‘extract’ producing raw materials that are cultivated in Africa and that are used in the manufacture of beers, soft drinks, cider, wine and spirits at our own production facilities in Africa.",0
11,> Ensuring the costing for drugs considers potential increases associated with transition risks (such as cost of fuels and changes to approval mechanisms).,1
12,"To meet its financial responsibility requirements, the firm Shipping maintains marine oil pollution liability insurance in respect of its operated ships to a maximum limit of $associations (P&I Clubs), although there can be no assurance that a spill would necessarily be adequately covered by insurance or that liabilities would not exceed insurance recoveries.",1
13,"– Logistics covers both inbound transport of raw agricultural inputs, processed inputs and packaging materials to our breweries as outbound distribution of beverages to the point of sale consumer, and warehouse energy consumption.",1
14,"> This high emissions ‘business as usual’ scenario was not modelled in detail but is expected to give rise to more significant physical impacts and delayed but more uncertain/disruptive transition, potentially leading to higher overall costs and representing failure to implement stated policies.",1
15,"Waste management provisions in the nuclear energy sector are based on obligations under public law, in particular the German Atomic Energy Act, and on restrictions from operating licenses.",1
16,"In order to mitigate the risk of short-term sales and price fluctuations, we sell most of our electricity forward, whilst also hedging the prices for necessary fuels and emission allowances.",0
17,"Historically, our operations have been seasonal, and extreme weather conditions, including natural disasters, unseasonable weather or changes in weather patterns, may diminish demand for our seasonal merchandise and could also influence consumer preferences and fashion trends, consumer traffic and shopping habits.",1
18,"First and foremost, these consist of our German electricity generation from coal and nuclear fuel as well as our lignite production in the Rhenish mining region to the west of Cologne.",1
19,• The Oil Pollution Act liability standards and other obligations governing the transportation of petroleum products in US waters.,1
20,"Putting customers and consumers firmly at the core, we aim to continually enhance and expand our portfolio and footprint.",0
21,Another project dedicated to the use of carbonaceous waste materials launched in June 2021.,1
22,"Where appropriate, the risk mitigation measures and interventions were escalated to site management and captured on the local risk register.",1
23,Louisiana Coastal restoration Six coastal parishes and the State of Louisiana have filed over seeking damages for coastal erosion.,1
24,"For example, the Environmental, Social and Governance Committee of the Board of Directors oversees the Company’s strategies, policies and practices regarding social issues and trends, including diversity and inclusion initiatives, health and safety, human rights, and philanthropy and community investment matters.",0
25,The gas business also opens up opportunities for activities in the field of hydrogen.,0
26,"Whenever we need fuel and COallowances to produce power, we secure the respective prices when we sell the electricity.",1
27,"We leverage our scale and global footprint, innovation capabilities, and strong ecosystem partnerships, together with our assets and platforms including MyWizard, MyNav and SynOps, to consistently deliver tangible value for our clients.",0
28,They also include the cost of conditioning and packaging radioactive waste generated during dismantling operations and the transportation of such waste to BGZ.,1
29,"We believe that without our active and ongoing commitment to the Reduction and Refinement of animals in research), our animal use would be much greater.",1
30,"Restructuring Post Alexion Acquisition Group Review In conjunction with the acquisition of Alexion, the enlarged Group has initiated a comprehensive PAAGR, aimed at integrating systems, structure and processes, optimising the global footprint and prioritising resource allocations and investments.",0
31,"For the the firm Energy Outlook outputs have been expanded to capture 16 regions and 15 end-use sectors; in addition process emissions from key industrial sectors are included, for the first time.",1
32,"The portfolio of increasingly digital and connected solutions includes electric vehicle charging infrastructure, renewable power solutions, modular substation packages, distribution automation products, switchboard and panelboards, switchgear, UPS solutions, circuit breakers, measuring and sensing devices, control products, wiring accessories, enclosures and cabling systems and intelligent home and building solutions, designed to integrate and automate lighting, heating, ventilation, security and data communication networks.",1
33,"Although we created a large number of jobs by expanding renewable energy, headcount in our core business declined somewhat.",1
34,"The pandemic may also have long-term effects on the nature of the office environment and remote working, which may result in increased costs and present operational and workplace culture challenges that may also adversely affect our business.",1
35,"Moving forward, we will continue our commitment to sourcing agricultural ingredients locally in Africa, with the aim to increase volume by compared to 2020.",1
36,We strive to preserve the nutritional value of our by-products by recirculating them in animal and human food applications.,0
37,We have used the GHG Protocol Corporate Accounting and Reporting Standard (revised edition).,1
38,"Hydro / Biomass / Gas: Generation from our run-of-river, pumped storage, biomass and gas power stations is pooled here.",1
39,The renewable thermal market is not as mature as electricity and its development requires a site-by-site approach.,1
40,e Natural gas liquids for Russia are included in crude oil.,1
41,In June solar inverters business which was sold in February 2020 (See Note 4 for details).,1
42,Our transition risk scenario analysis identified impacts on the earnings of our oil-priced businesses as having the most potential to impact the resilience of our strategy in 2030.,1
43,"GET Hspans the entire hydrogen value chain, from production and transport to industrial usage.",1
