,text,env
438,Sources of hedge effectiveness will depend on the hedge relationship designation but may include: > a significant change in the credit risk of either party to the hedging relationship > a timing mismatch between the hedging instrument and the hedged item > movements in foreign currency basis spread for derivatives in a fair value hedge > a significant change in the value of the foreign currency denominated net assets of the Group in a net investment hedge.,0
439,"The PSI captures GHG and water intensity metrics per product, per patient and per annum, as well as measures of % renewable power and resource efficiency used to make that product.",1
440,The Company continues to assess the potential impacts these events and similar events may have on the business in future periods and continues to develop contingency plans to assist in mitigating potential impacts.,0
441,"Mr Mitchell has also worked as a Corporate Advisor for Lowell Capital where he provided financial and technical analysis of projects and companies, including projects in Australia and various other countries such as USA, China, North Korea, Mongolia, Zambia, Egypt, Romania and Zimbabwe, and as Resource Analyst for Prudential Bache.",0
442,This will enable us to eliminate approximately of CO2 on the way to net zero.,1
443,"Such a maximum amount has not been indicative of our actual loss exposure in the past and we have not experienced significant losses related to these exposures to date; however, our historical experience may not be representative in the current environment given the economic and financial disruptions, particularly to travel, caused by the COVID- and resulting containment measures and staff shortages.",0
444,"In addition, we have a lesser degree of control over the business operations of the joint ventures and businesses in which we have made minority investments or in which we have acquired less than 100% of the equity.",0
445,"The Board considers short-term requirements against available sources of funding, taking into account forecast cash flows.",0
446,a session was held with members of our business resource groups that focus on ethnic diversity.,0
447,"At this time, the Company is not able to quantify the amount of future impacts, including any cash expenditures that may take place in future periods resulting from any potential flagship store closures given the unpredictable nature of lease exit negotiations and ultimate lease renewal decisions.",0
448,"Net zero« operations the firm’s aim to reach net zero operational greenhouse gas (COemissions by 2050 or sooner, on a gross operational control basis, in accordance with the firm’s aim 1 which relates to our reported Scope 1 and 2 emissions.",1
449,T We report Scope emissions material to our business on a carbon dioxide-equivalent basis.,1
450,"Depending on the nature of the operating lease, amortization and interest expense are primarily recorded within stores and distribution expense, marketing, general and administrative expense, or flagship store exit (benefits) charges on the Consolidated Statements of Operations and Comprehensive Income (Loss).",0
451,"The Company’s accounts receivable are first grouped by the individual legal entity which generally has a geographic concentration of receivables, resulting in different risk levels for different entities.",0
452,our progress Changes to KPIs Our greenhouse gas (GHG) emissions KPI now comprises Scope included in our aim 1 – net zero operations on an operational control basis.,1
453,"Accordingly, the company has established a diversity policy.",0
454,"In the Rhenish lignite mining area, water ingress at the Inden opencast mine brought production to a temporary halt.",0
455,"• The Resource Conservation and Recovery Act regulates the generation, storage, transportation and disposal of wastes associated with our operations and can require corrective action at locations where such wastes have been disposed of or released.",1
456,"We continue to raise the bar, including in the areas of leading benefits programs, increasing opportunities for internal mobility and development, enhancing our diversity and inclusion efforts, and providing competitive compensation.",0
457,"Through this collaboration, in sector-level water risk assessment of the global pharmaceutical supply chain.",0
458,The and pursuing efforts to limit the temperature increase to 1.5°C above pre-industrial levels' was reaffirmed at COP 26 in Glasgow during November 2021.,1
459,"We have been investing in a number of growth initiatives, including to attract new Card Members, retain existing Card Members and capture a greater share of customers’ total spending and borrowings.",0
460,"The Group has set out its intention – as part of the Ambition Zero Carbon programme – to achieve net-zero greenhouse gas emissions by maximising energy efficiency, shifting to renewable energy sources and investing in nature-based removals to compensate for any residual GHG footprint.",1
461,There will also be a cap on CO2 emissions.,1
462,"At the majority of this capacity will come from wind farms, solar assets and battery storage.",1
463,"The three key growth drivers for our businesses are: resource efficiency through electrification and automation, where we are global leaders, occupying number are accountable for growth and decision-making has been moved closer to the market; and the acceleration of environmental, social and governance (ESG) drivers for energy efficiency and automation.",1
464,Methane intensity Methane intensity refers to the amount of methane emissions from the firm’s operated upstream oil and gas assets as a percentage of the total gas that goes to market from those operations.,1
465,"Disclose Scope appropriate, Scope 3 greenhouse gas (GHG) emissions, and the related risks.",1
466,Green energy is the lifeblood of a sustainable economy.,1
467,"Working in tandem with Singapore-based Berkeley Energy Commercial Industrial Solutions (BECIS), we are building the largest biomass power plant in Cambodia to generate thermal energy for our production site, helping us reach our goals to reduce greenhouse gas emissions and contribute to the movement for renewable energy and climate change.",1
468,"To manage this risk, we seek to maintain access to a diverse set of cash, readily-marketable securities and contingent sources of liquidity, such that we can continuously meet our business requirements and expected future financing obligations for at least a twelve-month period in the event we are unable to raise new funds under our regular funding programs during a substantial weakening in economic conditions.",0
469,Our accomplishments demonstrate how seriously we are taking this: our carbon dioxide emissions from power production have more than halved since 2012.,1
470,Forecast cash flows include the impact of all approved emission reduction projects.,1
471,"In addition, our ability to adopt new technologies may be inhibited by the emergence of industry-wide standards, a changing legislative and regulatory environment, an inability to develop appropriate governance and controls, a lack of internal product and engineering expertise, resistance to change from Card Members or merchants, lack of appropriate change management processes or the complexity of our systems.",0
472,The aim here is to decrease the total number of emission allowances placed on the market.,1
473,"This requires the efficient production of safe, high quality agricultural products in a way that protects and improves the natural environment, social and economic conditions of farmers, their employees and local communities, and safeguards the health and welfare of all farmed species.",1
474,"The increased difference between Reported and Core Operating profit in the year is primarily due to items related to the acquisition of Alexion, increased intangible asset impairments and restructuring charges, of which $Acquisition Group Review (PAAGR), aimed at integrating systems, structure and operations to optimise the global footprint and prioritise resource allocations and investments, following the acquisition of Alexion.",0
475,We need to continually update and enhance our control environment to address operational and compliance risks.,0
476,"By contrast, wind, solar and hydro are energy sources which do not generate COsupply of electricity and heat.",1
477,"As the world seeks lower carbon fuels, we see opportunities to leverage our portfolio of assets and customer base – with bioenergy as one of our transition growth engines.",1
478,In mid-intend to use to test whether phosphorus can be reclaimed from sewage sludge using high-temperature conversion.,0
479,It is considered that these sources of income are sufficiently predictable or diversified to support a recognition period in excess of five years.,0
480,"As the wider healthcare system looks to deliver patient-centric net-zero healthcare, this will present some risks for the firm to manage, as well as some opportunities to deliver better patient and societal outcomes with a lower GHG footprint for the healthcare sector.",1
481,In aim to have long-term contextual water targets in place by 2025.,1
482,"Among other things, GLBA imposes certain limitations on our ability to share consumers’ nonpublic personal information with nonaffiliated third parties and requires us to develop, implement and maintain a written comprehensive information security program containing safeguards that are appropriate to the size and complexity of our business, the nature and scope of our activities and the sensitivity of customer information that we process.",0
483,The workforce engagement programme supports the UK Corporate Governance Code requirement that the board establishes a mechanism to have meaningful and regular dialogue with the workforce to capture key insights and to bring the employee voice into the boardroom.,0
484,"Also, projections of any evaluation of effectiveness to future periods are subject to the risk that controls may become inadequate because of changes in conditions, or that the degree of compliance with the policies or procedures may deteriorate.",0
485,"This requires management’s best estimate of how future changes to relevant carbon emission cost policies and/or legislation are likely to affect the future cash flows of the group’s applicable CGUs, whether currently enacted or not.",1
486,"After her degree and an internship at the firm, Iga joined the the firm Ability team in Poland where she found an ideal environment to develop and learn as one of the growing number of women in STEM (science, technology, engineering and mathematics) fields.",0
487,"on of such waste to BGZ Gesellschaft für Zwischenlagerung mbH (BGZ), which has been commissioned by the Federal government for intermediate storage.",0
488,to apply the principle of mitigation in the payment of compensation on the termination of the service contract of any Executive Director.,0
489,"This was reflected in the stock market’s positive reaction to our Growing Green strategy, as the the firm share closed trading that day with a strong gain and continued to perform well in the following weeks.",1
490,"The Asia Pacific region offers a large growth potential, and we are well positioned to capture it given our strong market positions.",0
491,We will use these funds exclusively for wind and solar projects.,1
492,"To help address one of the most consequential threats facing the world, climate change, we have committed to net-zero emissions by climate change.",1
493,"We expect developing markets, including Africa, the Commonwealth of Independent States (CIS), the Indian subcontinent and Latin America, to fuel pharmaceutical growth.",0
494,"Accordingly, the Board has developed the following objectives regarding gender diversity and aims to achieve these objectives as Director and senior executive positions become vacant and appropriately qualified candidates become available: achieve a diverse and skilled workforce, leading to continuous improvement in the achievement of its corporate goals; The Company has a formal policy and comprehensive procedures on continuous disclosure.",0
495,"Any one of these risks, or a combination of risks, could result in further adverse impacts on the Company’s business, results of operations, financial condition and cash flows.",0
496,Estimate and report material upstream and downstream (GHG Protocol Scope emissions where appropriate.,1
497,"Whether it’s expanding renewable energy capacities, transitioning to a hydrogen economy or opting for environmentally friendly carbon recycling methods, technical challenges lurk behind every turn, waiting for solutions to address them.",1
498,"impacts of economic, geopolitical and competitive conditions and certain litigation and regulatory matters on our business.",0
499,"Excluding the interest accretion, additions to provisions for nuclear waste management are based on quantity-related increases in the provisions as well as updates of the cost estimates and amount to €162 million.",0
0,We believe that the audit evidence we have obtained is sufficient and appropriate to provide a basis for our audit opinion.,0
1,The conditions corres- pond to those applicable to independent third parties.,0
2,Regular training courses on operational risks enhance the staff’s general awareness of these issues.,0
3,"These bodies ensure that a disciplined risk culture is promoted, and thus risk transparency is enhanced.",0
4, The number of employees adjusted to account for part-time staff represents 710 as at year end (previous year: 699).,0
5,"On behalf of the Board of Directors and Management, we would like to thank our customers and business partners for the trust they have placed in us.",0
6,Our employees contribute with their personal engagement significantly to the success of our Bank.,0
7,"As Scout24 endeavours journeys into the digital future, it finds itself in a high-tech online world.",0
8,"Together with our business partners, we ensure payment security, attractive health coverage and protection against credit card abuse.",0
9,We always focus on proximity to the customer and personal service.,0
10,The individual financial needs of our customers are in the centre of our daily activities; here we concentrate on our core areas of expertise,0
11,"GE Money Bank’s consolidated liabilities to group companies represent 45.2% of all borrowed capital, or 1.5 billion CHF",0
12,"This development is primarily due to the decrease in the amounts due from customers position, which has declined by 166.9 million CHF mainly due to the securitisation transaction launched in March 2012.",0
13,"Funding requirements are covered by the Bank’s parent company, third-party banks, the capital market and through money received from customers.",0
14,Other business areas GE Money Bank AG mainly operates in the field of rented real estate properties.,0
15,The Bank has two fully consolidated participating interests.,0
16,There is no requirement to hold capital for such risks arising from a non-trading book.,0
17,"As a result, foreign exchange positions arise only to a very small extent.",0
18,The market risks standard approach is applied to calculate the necessary equity.,0
19,Liquidity risks Solvency is monitored and ensured in accordance with banking regulations.,0
20,"The Bank’s Management continuously supervises both the minimum reserves (previously referred to as cash liquidity) and the total liquidity, and gives a regular account to ALCO and the Board of Directors of the Bank.",0
21,These are recorded at nominal value or acquisition cost.,0
22,The discount not yet earned is deferred in the respective balance sheet position over the term of the agreement.,0
23,Amounts due from banks Loans and interest thereon due but not yet paid are disclosed at nominal value less any value adjustments.,0
24,"Amounts due from customers As a general rule, loans are disclosed at nominal value less value adjustments.",0
25,"Lease financing is recorded at the value of amortised tangible assets plus due and unpaid interest, default interest and fees.",0
26,"tRust assets totalled 8,777 thousand euros at 30 September 2016 (at start of financial year: 7,144 thousand euros).",0
27,"Members of management are appointed by the Board and serve at the discretion of the Board, subject to any applicable agreement.",0
28,"For additional information, please see also section 3.4.",0
29,"On 17 December 2018, the Company drew down €250 million from line A of the syndicated loan.",0
30,"priorities Change from last year We operate in highly regulated markets and interact with a number of regulators across the globe, in an environment where the nature and focus of regulation and laws remain fluid.",0
31,Risk oversees the application of the liquidity risk framework and adherence to the risk appetite as approved by the Executive Board.,0
32,The Company has taken advantage of the exemption in Section 408 of the Companies Act 2006 not to present its own income statement in these financial statements.,0
33,The ordinary shares carry the right to vote and rank pari passu for dividends.,0
34,The AGM is a key opportunity for the Board to engage with shareholders to answer questions and is the main forum for dialogue with private shareholders and the Board.,0
35,Tangible assets are disclosed under financial investments and proceeds from their sale as well as any value adjustments are regarded as recoveries and collected accordingly.,0
36,The Board of Directors may determine a different ratio for the Corporate Executive Board as a whole or for the Chairman (Group CEO) or individual members of the Corporate Executive Board (discretionary decision).,0
37,"These matters included those which had the greatest effect on: the overall audit strategy, the allocation of resources in the audit; and directing the efforts of the engagement team.",0
38,"As set out in the Chairman’s Statement, it has been a challenging year for our industry and markets more generally.",0
39,"We now have a robust asset management platform with over 430 employees, working across nine countries.",0
40,Staff Training Plans are drawn up yearly and hinged on grade specific base-line programmes.,0
41,"For DBAG Fund V, DBAG Fund VI and DBAG Fund VII, fees during the investment phase are based on the committed capital (DBAG Fund VI in the current financial year leading up to December 2016 and DBAG Fund VII1 since then).",0
42,* Please note that this request would not be processed if the signature(s) herein differs from that which appears in the Registrar’s records.,0
43,An equity incentive award which is typically delivered by the RSU plan.,0
44,"In the main, the period for which the model considers the future recovery of amounts previously written off was increased from 48 months to 72 months.",0
45,"The Company may before this authority expires, make an offer or enter into an agreement which would or might require equity securities to be allotted after such expiry and the Directors may allot equity securities in pursuance of that offer or agreement as if the power conferred by this resolution had not expired.",0
46,Under company law the Directors must not approve the financial statements unless they are satisfied that they give a true and fair view of the state of affairs of the Company and of the profit or loss of the Company for that period.,0
47,"The Supervisory Board profile of requirements includes, in particular, the knowledge, skills and professional expertise that are collectively required to perform the tasks of the Supervisory Board of DWS, taking into account the suitability and properness requirements of the European Banking Authority and the standards which are required under applicable laws (collective qualifications).",0
48,Annual training expenditure (in thousands of euros) (4) 172.1 74.5 Excluding Sofidy and ACE Management.,0
49,Our investment portfolio decreased in value by £2.2m over the year reflecting a number of write-downs in relation to our early-stage unquoted investments.,0
50,"We will continue to work on creating a leading fiduciary asset manager with a clear performance-driven culture, with entrepreneurship and collaboration across its global platform.",0
51,we have allocated operational risks to the business line that is most strongly affected by the risk.,0
52,"Additionally, 1,962 shareholder warrants were exercised during the year at a price of 323.27p.",0
53,Effective Fraud Risk Assessment programme that ensures fraud risks are adequately managed and mitigated through bank-wide anti-fraud training and awareness sessions.,0
54,"As Clare remains within the M&G group, no payment in lieu of notice or other termination payment was made to her on stepping down from the Board.",0
55,"Supervisory law requires the Group and all its insurance and reinsurance companies to have a proper, effective business organisation in place that ensures sound, prudent business management.",0
56,"In 2000, he joined the European Leveraged Finance team.",0
57,"Investment mandates specify explicitly the counterparty risk appetite for cash on deposit, foreign exchange and OTC trading whilst other counterparty risk is taken for the purposes of efficient portfolio management and reduction in risk.",0
58,SCOR will be unable to accurately predict the impact of future changes in tax law on the taxation of life insurance in the hands of policyholders.,0
59,"Operating capital generation is the total capital generation before tax, adjusted to exclude market movements relative to those expected under long-term assumptions and to remove other non-operating items, including shareholder restructuring and other costs as defined under adjusted operating profit before tax.",0
60,"If an acquirer of shares is not prepared to provide this declaration, the Board may refuse to register him as a shareholder with the right to vote.",0
61,The proportion of transaction opportunities that we followed up was unchanged at around three-quarters.,0
62,and the Supervisory Board The remuneration report beginning on page 84 ff.,0
63,"GmbH & co. KG Unconsolidated subsidiary 0 20.8 For dBaG Fund V, a group of key management personnel as well as individual former key management personnel and other members of the investment team have invested their own money at a fixed ratio in all of the four fund companies listed above.",0
64,“Financial instruments classified at fair value through profit or loss” are structured products that are recognised using the fair value option.,0
65,"(ii) Total fair value movements on other capital hedges, which are solely held to optimise the Solvency II capital position.",0
66,"The company itself is not active in the operating asset management business, but rather holds a large number of major shareholdings.",0
67,"This isn’t just a market trend, it’s the right thing to do for our planet and society.",1
68,"Yes In the absence of business ties between Mr Jean Charest and Tikehau Capital, as the service agreement between the Company and Chardi Inc, a company of which Jean Charest is manager and shareholder, ended on 31 December 2018, the Supervisory Board considered that all the criteria set out in Article 8.5 of the AFEP-MEDEF Code were met.",0
69,Relative Carbon Footprint (also called Carbon to1) Value ratio): allocated carbon footprint per € million invested that captures the absolute impact of the portfolio per € million invested; held (total of the carbon emissions held divided by total revenues attributed to the portfolio) which assesses the efficiency of the portfolio; Carbon Intensity (also called Carbon to Revenue2) ratio): allocated carbon footprint per € million of revenues Weighted Average Carbon Intensity: arithmetical3) average carbon intensities of portfolio companies weighted by their portfolio weights which allows exposure to high emission companies to be assessed.,1
70,The latter are approved by the Group COMEX and are submitted annually to the Audit Committee and to the Board of Directors of the Company.,0
71,(5) Absolute compliance with the Group's ethical principles as described in the Code of Conduct of the SCOR Group.,0
72,Mr Kreuzkamp also serves as Management Board member of DWS Group entities DWS Investment GmbH and DWS Beteiligungs GmbH.,0
73,"The Fontavis portfolios are focused on thermal, water, solar and wind power.",1
74,"In 2020, we aim to increase our focus on smart ESG integration across the investment platform, intend to establish a Group Sustainability Office, and to continue to embed ESG into all of our corporate activities.",1
75,Key management personnel of DBAG serve on a number of supervisory bodies of companies in the portfolio of DBAG as well as of the funds stated above.,0
76,"We expect premium income in property/casualty insurance to continue to rise in Germany in 2020, albeit at a slower rate than in the reporting period.",0
77,Current and deferred taxes are recognized in profit or loss except to the extent that the tax relates to items that are recognized directly in equity or other comprehensive income in which case the related tax is recognized either directly in equity or other comprehensive income accordingly.,0
78,"More fully model our balance sheet, incorporating consideration of liabilities (and perhaps capital position) alongside our asset portfolios in each climate scenario.",1
79,Our responsibility is to audit and express an opinion on the financial statements in accordance with applicable law and International Standards on Auditing (UK and Ireland).,0
80,The advisory fee amounts to 2.0 percent of the capital commitment of 183 million euros to DBAG Fund VII Konzern SCSp and 1.0 percent of the cost to DBAG Fund VII Konzern B SCSp.,0
